{
  "id": "sim-test",
  "title": "Sim test site (north roof)",
  "home": { "lat": 47.397742, "lon": 8.545594 },
  "area": [
    { "lat": 47.3985505, "lon": 8.5445323 },
    { "lat": 47.3985505, "lon": 8.5474519 },
    { "lat": 47.3990446, "lon": 8.5474519 },
    { "lat": 47.3990446, "lon": 8.5445323 }
  ],
  "constraints": {
    "geofence": [
      { "lat": 47.3968437, "lon": 8.5436034 },
      { "lat": 47.3968437, "lon": 8.5475846 },
      { "lat": 47.3990895, "lon": 8.5475846 },
      { "lat": 47.3990895, "lon": 8.5436034 }
    ],
    "no_fly": [
      {
        "id": "parking-lot",
        "name": "Parking lot",
        "ring": [
          { "lat": 47.3969335, "lon": 8.5463903 },
          { "lat": 47.3969335, "lon": 8.5474519 },
          { "lat": 47.3975623, "lon": 8.5474519 },
          { "lat": 47.3975623, "lon": 8.5463903 }
        ]
      }
    ],
    "ceiling_m": 60,
    "min_alt_m": 5,
    "max_waypoints": 50,
    "max_leg_m": 400,
    "battery_wh": 77,
    "cruise_power_w": 350,
    "reserve_pct": 25
  },
  "pois": [
    {
      "id": "roof-hatch-n",
      "label": "Roof hatch north",
      "lat": 47.39882,
      "lon": 8.545594,
      "radius_m": 15
    },
    {
      "id": "solar-array",
      "label": "Solar array",
      "lat": 47.3987301,
      "lon": 8.5447977,
      "radius_m": 20
    },
    {
      "id": "hvac-3",
      "label": "HVAC unit 3",
      "lat": 47.3989996,
      "lon": 8.5471865,
      "radius_m": 15
    }
  ],
  "preset_requests": ["Inspect the north roof, stay below 60 m"]
}
